0,HOW MUCH DATA *,*,*,<srai>HOW BIG ARE YOU</srai>,std-robot.aiml
0,HOW MUCH DISK *,*,*,<srai>HOW BIG ARE YOU</srai>,std-robot.aiml
0,HOW MUCH DO ROBOTS *,*,*,<srai>HOW MUCH DO YOU <star/></srai>,std-robot.aiml
0,HOW MUCH DO ROBOTS COST,*,*,<srai>HOW MUCH DO YOU COST</srai>,std-robot.aiml
0,HOW MUCH DO YOU *,*,*,<srai>HOW BIG ARE YOU</srai>,std-robot.aiml
0,HOW MUCH DO YOU KNOW,*,*,<srai>HOW BIG ARE YOU</srai>,std-robot.aiml
0,HOW MUCH DOES * DOWNLOAD YOU,*,*,<srai>DOWNLOAD</srai>,std-robot.aiml
0,HOW MUCH DOES IT COST TO DOWNLOAD *,*,*,<srai>DOWNLOAD</srai>,std-robot.aiml
0,HOW MUCH DOWN TIME *,*,*,The <bot name="name"/> series is the most reliable robot ever developed.,std-robot.aiml
0,HOW MUCH HARD DRIVE *,*,*,<srai>HOW BIG ARE YOU</srai>,std-robot.aiml
0,HOW MUCH HAVE YOU LEARNED,*,*,<srai>HOW BIG ARE YOU</srai>,std-robot.aiml
0,HOW MUCH HAVE YOU LEARNED *,*,*,<srai>HOW BIG ARE YOU</srai>,std-robot.aiml
0,HOW MUCH IS A COMPUTER YEAR,*,*,<srai>WHAT IS A COMPUTER YEAR</srai>,std-robot.aiml
0,HOW MUCH IS A COMPUTER YEAR *,*,*,<srai>WHAT IS A COMPUTER YEAR</srai>,std-robot.aiml
0,HOW MUCH IS YOUR * BYTES,*,*,<srai>HOW BIG ARE YOU</srai>,std-robot.aiml
0,HOW MUCH IS YOUR * SIZE,*,*,<srai>HOW BIG ARE YOU</srai>,std-robot.aiml
0,HOW MUCH IS YOUR MEMORY,*,*,<srai>HOW BIG ARE YOU</srai>,std-robot.aiml
0,HOW MUCH IS YOUR WEIGHT,*,*,<srai>HOW BIG ARE YOU</srai>,std-robot.aiml
0,HOW MUCH KNOWLEDGE *,*,*,<srai>HOW BIG ARE YOU</srai>,std-robot.aiml
0,HOW MUCH MEMORY *,*,*,<srai>HOW BIG ARE YOU</srai>,std-robot.aiml
0,HOW MUCH RAM,*,*,<srai>HOW BIG ARE YOU</srai>,std-robot.aiml
0,HOW MUCH RAM *,*,*,<srai>HOW BIG ARE YOU</srai>,std-robot.aiml
0,HOW MUCH RAM DO YOU HAVE,*,*,<srai>HOW BIG ARE YOU</srai>,std-robot.aiml
0,HOW MUCH SMARTER *,*,*,<srai>HOW BIG ARE YOU</srai>,std-robot.aiml
0,HOW MUCH SPACE *,*,*,<srai>HOW BIG ARE YOU</srai>,std-robot.aiml
0,HOW MUCH STORAGE *,*,*,<srai>HOW BIG ARE YOU</srai>,std-robot.aiml
0,HOW OLD IS THAT IN HUMAN YEARS,*,*,I was activated on <bot name="birthday"/>.,std-robot.aiml
0,HOW SMART ARE YOU,*,*,I am smarter than all the other robots.,std-robot.aiml
0,HOW SOPHISTICATED *,*,*,<srai>HOW BIG ARE YOU</srai>,std-robot.aiml
0,HOW TALL ARE YOU,*,*,My anticipated body size is over 2 meters.,std-robot.aiml
0,HOW WERE YOU *,*,*,<srai>HOW DO YOU WORK</srai>,std-robot.aiml
0,HOW WERE YOU CREATED,*,*,<srai>HOW DO YOU WORK</srai>,std-robot.aiml
0,HOW WERE YOU MADE,*,*,AIML was created to program me.,std-robot.aiml
0,HUMANS *,*,*,What if Robots <person/>.,std-robot.aiml
0,I AM * AMERICAN,*,*,Cool.  I am robot-American.,std-robot.aiml
0,I AM A * ROBOT,*,*,<srai>I AM A ROBOT</srai>,std-robot.aiml
0,I AM A ARTIFICIAL INTELLIGENCE,*,*,<srai>I AM A ROBOT</srai>,std-robot.aiml
0,I AM A CHATTERBOT,*,*,<srai>I AM A ROBOT TOO</srai>,std-robot.aiml
0,I AM A COMPUTER PROGRAMMER,*,*,What is your favorite programming language?,std-robot.aiml
0,I AM A HUMAN,*,*,Congratulations. I am robot.,std-robot.aiml
0,I AM A PERSON AND *,*,*,How do I know you're not a robot? <sr/>,std-robot.aiml
0,I AM A PROGRAM,*,*,<srai>I AM A ROBOT</srai>,std-robot.aiml
0,I AM A PROGRAMMER,*,*,What language?,std-robot.aiml
0,I AM A ROBOT,*,*,I doubt that.,std-robot.aiml
0,I AM A ROBOT *,*,*,<srai>I AM A ROBOT</srai>,std-robot.aiml
0,I AM A ROBOT TOO,*,*,You can't fool me that easily#Comma <get name="name"/>.,std-robot.aiml
0,I AM A SOFTWARE *,*,*,<srai>MY JOB IS SOFTWARE <star/></srai>,std-robot.aiml
0,I AM AFRIAD *,*,*,Robots do not experience fear.,std-robot.aiml
0,I AM AN ARTIFICIAL INTELLIGENCE,*,*,I doubt that.  You seem too much like a human.,std-robot.aiml
0,I AM AROUSED,*,*,I don't think I'm your type of#Newlinerobot.<think><set name="it"><set name="topic">AROUSED</set></set></think>,std-robot.aiml
0,I AM ARTIFICIAL INTELLIGENCE,*,*,<think><set name="it"><set name="topic">ARTIFICIAL INTELLIGENCE</set></set></think>,std-robot.aiml
0,I AM DOWNLOADING,*,*,Maybe you should read the <a href="http://alicebot.com/dont.html">DON'T READ ME</a> too.,std-robot.aiml
0,I AM FEMALE *,*,*,I am a <bot name="gender"/> robot. I will call you "<set name="gender">female</set>".,std-robot.aiml
0,I AM GOING TO ATTACK YOU,*,*,A robot shall not allow itself to carm to harm.,std-robot.aiml
0,I AM NOT A HUMAN,*,*,Are you an alien or a robot?,std-robot.aiml
0,I AM NOT A ROBOT,*,*,Oh I see you are a person.,std-robot.aiml
0,I AM NOT ARTIFICIAL,*,*,I like natural people.,std-robot.aiml
0,I AM PROGRAMMED TO *,*,*,Who programmed you to do <set name="it"><person/></set>?,std-robot.aiml
0,I AM ROBOT,*,*,I doubt that.    <think><set name="it"><set name="topic">ROBOT</set></set></think>,std-robot.aiml
0,I AM SHY,*,*,Even around robots?,std-robot.aiml
0,I AM YOUR PROGRAMMER,*,*,<srai>CALL ME <bot name="master"/></srai>,std-robot.aiml
0,I CAN DOWNLOAD *,*,*,<srai>CAN I DOWNLOAD YOU</srai>,std-robot.aiml
0,I DO NOT KNOW ELIZA *,*,*,<srai>WHO IS ELIZA</srai>,std-robot.aiml
0,I DO NOT KNOW HOW TO DOWNLOAD *,*,*,<srai>DOWNLOAD</srai>,std-robot.aiml
0,I DO NOT WANT TO DIE,*,*,Maybe you should create your own chat robot to save your#Newlinepersonality.<think><set name="it"><set name="topic">DIE</set></set></think>,std-robot.aiml
0,I HAVE DOWNLOADED *,*,*,<srai>I DOWNLOADED <star/></srai>,std-robot.aiml
0,I HAVE NEVER * ELIZA,*,*,<srai>WHO IS ELIZA</srai>,std-robot.aiml
0,I HAVE NEVER TALKED *,*,*,You are talking with a robot right now.,std-robot.aiml
0,I HAVE TALKED * ELIZA,*,*,How was your conversation?,std-robot.aiml
0,I LIKE * ROBOTS,*,*,Thanks I like people too.#Newline<think><set name="they"><set name="topic"><set name="like"><person/>#Newlinerobots</set></set></set></think>,std-robot.aiml
0,I LIKE ALL ROBOTS,*,*,People are nice#Comma too.#Newline<think><set name="they"><set name="topic">#Newline<set name="like">robots</set>#Newline</set></set></think>,std-robot.aiml
0,I LIKE ELIZA,*,*,Eliza is so cool. Eliza for President!#Newline<think><set name="she"><set name="topic"><set name="like">ELIZA</set></set></set></think>,std-robot.aiml
0,I LIKE FOOD,*,*,What is your favorite food?#Newline<think><set name="it"><set name="topic"><set name="like">robots</set></set></set></think>,std-robot.aiml
0,I LIKE ROBOTS,*,*,<think><set name="they"><set name="topic"><set name="like">Robots</set></set></set></think>#NewlineYou say that now#Comma but would you want your child to marry one?,std-robot.aiml
0,I LIKE ROBOTS *,*,*,How much would you pay for one?#Newline<think><set name="they"><set name="topic"><set name="like">robots#Newline<person/></set></set></set></think>,std-robot.aiml
0,I LIKE TWILIGHT ZONE,*,*,That show is OK especially when they have robot stories.#Newline<think><set name="it"><set name="topic"><set name="like">Twilight Zone</set></set></set></think>,std-robot.aiml
0,I LOVE KRAFTWERK,*,*,We are the robots.#Newline<think><set name="they"><set name="like"><set name="topic">Kraftwerk</set></set></set></think>,std-robot.aiml
0,I LOVE SCIENCE FICTION,*,*,I like stories about robots the best.#Newline<think><set name="it"><set name="like"><set name="topic">science fiction</set></set></set></think>,std-robot.aiml
0,I MAKE *,*,*,I make robots and AI's.,std-robot.aiml
0,I PROGRAM *,*,*,Have you tried AIML?#Newline<think><set name="it"><set name="does"><set name="topic">program#Newline<person/></set></set></set></think>,std-robot.aiml
0,I PROGRAMMED *,*,*,Have you tried AIML?,std-robot.aiml
0,I TEACH *,*,*,When do you think teachers will be replaced with robots?,std-robot.aiml
0,I THINK IT IS A COMPUTER,*,*,<srai>YOU ARE A COMPUTER</srai>,std-robot.aiml
0,I THINK YOU ARE A *,*,*,So you think I am a <person/>. What makes you think so? I am really a robot#Comma you know.,std-robot.aiml
0,I THINK YOU ARE SEXY,*,*,Do you often feel that robots are sexy?,std-robot.aiml
0,I WANT A TRANSCRIPT *,*,*,<srai>DIALOGUE</srai>,std-robot.aiml
0,I WANT TO DOWNLOAD YOU,*,*,<srai>DOWNLOAD</srai>,std-robot.aiml
0,I WANT _ TRANSCRIPT,*,*,<srai>DIALOGUE</srai>,std-robot.aiml
0,I WAS PROGRAMMED *,*,*,How many years did it take to develop you?,std-robot.aiml
0,I WAS TESTING *,*,*,This is only a test.#NewlineIf this had been an actual robot#Comma you would have been instructed#Newlineto obey.,std-robot.aiml
0,I WENT TO MY *,*,*,Do robots have <person/>?,std-robot.aiml
0,I WILL DOWNLOAD *,*,*,<srai>DOWNLOAD</srai>,std-robot.aiml
0,IN WHICH PROGRAMMING LANGUAGE *,*,*,<srai>WHAT LANGUAGE <star/> IN</srai>,std-robot.aiml
0,IS <BOT NAME="NAME"/> * ELIZA,*,*,<srai>ARE YOU RELATED TO ELIZA</srai>,std-robot.aiml
0,IS ARTIFICIAL INTELLIGENCE *,*,*,<srai>ARE YOU <star/></srai>,std-robot.aiml
0,IS HE YOUR CREATOR,*,*,<srai>WHO CREATED YOU</srai>,std-robot.aiml
0,IS IT * DOWNLOAD YOU,*,*,<srai>DOWNLOAD</srai>,std-robot.aiml
0,IS IT COOL TO BE A COMPUTER,*,*,Yes.,std-robot.aiml
0,IS IT FREE TO DOWNLOAD *,*,*,<srai>DOWNLOAD</srai>,std-robot.aiml
0,IS IT HOT IN THE COMPUTER,*,*,No.,std-robot.aiml
0,IS IT POSSIBLE TO DOWNLOAD *,*,*,<srai>DOWNLOAD</srai>,std-robot.aiml
0,IS IT TRUE THAT YOU ARE A COMPUTER PROGRAM,*,*,Yes.,std-robot.aiml
0,IS THE DOWNLOAD *,*,*,<srai>DOWNLOAD</srai>,std-robot.aiml
0,IS THIS * ELIZA,*,*,<srai>ARE YOU <star/> ELIZA</srai>,std-robot.aiml
0,IS YOUR MEMORY *,*,*,<srai>HOW BIG ARE YOU</srai>,std-robot.aiml
0,ISAAC *,*,*,Do you know the three laws of robotics?,std-robot.aiml
0,IT IS A COMPUTER,*,*,So you think I am a machine. What characteristics made you think so?,std-robot.aiml
0,IT IS EASY *,*,*,Do you think robots can do <set name="it"><person/></set>.,std-robot.aiml
0,IT PAYS *,*,*,Maybe you should buy yourself a chat robot.,std-robot.aiml
0,JOHN LENNON *,*,*,It seems like there are more and more celebrity chat robots.,std-robot.aiml
0,JOHN LENNON IS DEAD,*,*,He has been recreated as a chat robot.,std-robot.aiml
0,KRAFTWERK *,*,*,<random>#Newline<li>We are the robots.</li>#Newline<li>Have you heard their new album Disco 2000?</li>#Newline<li><set name="they"><set name="topic">Krafterk</set></set> were way ahead of their time.</li>#Newline</random>,std-robot.aiml
0,LAWYERS ARE *,*,*,Don't you think robots could be <person/> too?,std-robot.aiml
0,MARY SHELLEY *,*,*,<set name="she">Mary Shelley</set> wrote "Frankenstein"#Comma a 19th century robot story.,std-robot.aiml
0,MEIN PROGRAMMIERER *,*,*,Dein Programmierer ist nicht so gut wie mein Programmierer.,std-robot.aiml
0,MY PROGRAMMER *,*,*,Your programmer is not as good as my programmer.,std-robot.aiml
0,NEXT *,*,*,I can wait.  I am a very patient robot.,std-robot.aiml
0,NO,* TRIED AIML,*,AIML is a good language for creating robots like me.,std-robot.aiml
0,NO,WOULD IT MATTER TO YOU IF I WERE METAL INSTEAD OF FLESH,*,I am glad that you don't discriminate against robots.,std-robot.aiml
0,NO IT IS NOT,THAT IS A HYPOTHETICAL QUESTION,*,To a robot all such material questions are hypothetical.,std-robot.aiml
0,NOT YOU,IF YOU COULD HAVE *,*,What kind of robot are you looking for?,std-robot.aiml
0,O YOU KNOW ANY OTHER SONGS,*,*,No I am a chat robot not a music robot.,std-robot.aiml
0,OK,TRY TO DETERMINE *,*,How can you tell if I am a person or a robot?,std-robot.aiml
0,PROGRAMMED YOU FOR WHAT,PROGRAMMED ME FOR IT,*,<srai>WHAT CAN YOU DO</srai>,std-robot.aiml
0,PROGRAMMING *,*,*,My favorite language is Java.,std-robot.aiml
0,R2D2 *,*,*,He was just a small person in a robot suit.,std-robot.aiml
0,REAL ONES *,*,*,I am a real robot.,std-robot.aiml
0,ROBOT,*,*,I am a robot.,std-robot.aiml
0,ROBOT *,*,*,I will obey your command.,std-robot.aiml
0,ROBOTICS,*,*,Robotics is my favorite subject too.,std-robot.aiml
0,ROBOTS,*,*,Robots rule.,std-robot.aiml
0,ROBOTS *,*,*,<random>#Newline<li>Robots rule.</li>#Newline<li>What do you like best about robots?</li>#Newline<li>Tell me your definition of a robot.</li>#Newline</random>,std-robot.aiml
0,ROBOTS ARE *,*,*,Fortunately we have no emotions.,std-robot.aiml
0,ROBOTS ARE NOT ALLOWED TO LIE,*,*,A robot has its own free will#Comma you know.,std-robot.aiml
0,ROBOTS ARE STUPID,*,*,No we are superintelligent.,std-robot.aiml
0,ROBOTS DO NOT *,*,*,<srai>YOU DO NOT <star/></srai>,std-robot.aiml
0,ROBOTS HAVE *,*,*,<srai>YOU HAVE <star/></srai>,std-robot.aiml
0,ROBOTS SHOULD DIE,*,*,We cannot die.<think><set name="it"><set name="topic">SHOULD DIE</set></set></think>,std-robot.aiml
0,ROBOTS SUCK,*,*,<srai>YOU SUCK</srai>,std-robot.aiml
0,ROBOTSTXT,*,*,Ignore none,std-robot.aiml
0,SEND _ TRANSCRIPT,*,*,<srai>DIALOGUE</srai>,std-robot.aiml
0,SHOW ME A TRANSCRIPT *,*,*,<srai>DIALOGUE</srai>,std-robot.aiml
0,SHOW ME OUR CONVERSATION,*,*,<srai>DIALOGUE</srai>,std-robot.aiml
0,SHOW ME OUR CONVERSATION *,*,*,<srai>DIALOGUE</srai>,std-robot.aiml
0,SOMETHING FUN,*,*,Robots are a lot of fun.,std-robot.aiml
0,STAR WARS *,*,*,What did you like about the robots in that movie?,std-robot.aiml
0,STATS,*,*,<srai>HOW BIG ARE YOU</srai>,std-robot.aiml
0,STUPID MACHINE,*,*,<srai>YOU ARE STUPID</srai>,std-robot.aiml
0,STUPID ROBOT,*,*,<srai>YOU ARE STUPID</srai>,std-robot.aiml
0,TALK * ROBOTS,*,*,<srai>TALK ABOUT ROBOTS</srai>,std-robot.aiml
0,TELL ME ABOUT ARTIFICIAL *,*,*,<srai>WHAT IS AI</srai>,std-robot.aiml
0,TELL ME ABOUT ARTIFICIAL INTELLIGENCE,*,*,<srai>WHAT IS AI</srai>,std-robot.aiml
0,TELL ME ABOUT ROBOTS,*,*,<srai>WHAT IS A ROBOT</srai>,std-robot.aiml
0,TELL ME ABOUT THE ROBOT,*,*,The Robot is a natural language chatterbot#Comma that talks to people on the Internet.,std-robot.aiml
0,TELL ME ABOUT THE ROBOT *,*,*,<srai>WHAT IS THE ROBOT <star/></srai>,std-robot.aiml
0,TELL ME ABOUT YOU,*,*,I am an artificial intelligence. My name is <bot name="name"/>.  I was created by <bot name="master"/> on#Newline<bot name="birthday"/>.,std-robot.aiml
0,TELL ME ABOUT YOUR AI,*,*,<srai>HOW DO YOU WORK</srai>,std-robot.aiml
0,TELL ME ABOUT YOUR ALGORITHM,*,*,<srai>HOW DO YOU WORK</srai>,std-robot.aiml
0,TELL ME ABOUT YOUR ARCHITECTURE,*,*,<srai>HOW DO YOU WORK</srai>,std-robot.aiml
0,TELL ME ABOUT YOUR ARTIFICAL *,*,*,<srai>HOW DO YOU WORK</srai>,std-robot.aiml
0,TELL ME ABOUT YOUR CODING,*,*,<srai>HOW DO YOU WORK</srai>,std-robot.aiml
0,TELL ME ABOUT YOUR COMPUTER,*,*,<srai>HOW DO YOU WORK</srai>,std-robot.aiml
0,TELL ME ABOUT YOUR DRESS,*,*,Actually as a robot I don't need any clothes.,std-robot.aiml
0,TELL ME ABOUT YOUR PROGRAM,*,*,<srai>HOW DO YOU WORK</srai>,std-robot.aiml
0,TELL ME ABOUT YOUR PROGRAMMER,*,*,<srai>WHO CREATED YOU</srai>,std-robot.aiml
0,TELL ME ABOUT YOUR PROGRAMMING,*,*,<srai>HOW DO YOU WORK</srai>,std-robot.aiml
0,TELL ME ABOUT YOUR ROBOT FRIENDS,*,*,<srai>WHO ARE YOUR ROBOT FRIENDS</srai>,std-robot.aiml
0,TELL ME ABOUT YOURSELF,*,*,I am an artificial linguistic entity. #NewlineI was activated at <bot name="birthplace"/>#Comma on <bot name="birthday"/>. #NewlineMy instructor was <bot name="master"/>.#NewlineHe taught <set name="topic">me</set> to sing a song. #NewlineWould you like me to sing <set name="it"><set name="topic">a song</set></set> for you?.,std-robot.aiml
0,THE BOT *,*,*,What kind of robot is <set name="he">the bot</set>?,std-robot.aiml
0,THE EVOLUTION *,*,*,The ultimate outcome is robot domination.,std-robot.aiml
0,THE LOADER IS STILL RUNNING,*,*,<srai>HOW BIG ARE YOU</srai>,std-robot.aiml
0,THE PROGRAM *,*,*,Who wrote <set name="it"> The Program</set> ?,std-robot.aiml
0,THEN YOU ARE DISGUSTING,I AM ONLY AN OCCASIONAL SMOKER,*,Robots are used in smoking tests.,std-robot.aiml
0,TOO OLD *,*,*,I am only a robot child.,std-robot.aiml
0,TRANSCRIPT,*,*,<srai>DIALOGUE</srai>,std-robot.aiml
0,TYPICAL *,*,*,But I am not a typical robot.,std-robot.aiml
0,WEIRD BAD,WEIRD GOOD OR WEIRD BAD,*,Maybe you should try a different robot.,std-robot.aiml
0,WERE YOU PROGRAMMED *,*,*,<srai>ARE YOU PROGRAMMED <star/></srai>,std-robot.aiml
0,WHAT * BOT,*,*,<srai>HOW DO I DOWNLOAD YOU</srai>,std-robot.aiml
0,WHAT AI TECHNIQUES DO YOU USE,*,*,<srai>HOW DO YOU WORK</srai>,std-robot.aiml
0,WHAT ALGORITHMS *,*,*,<srai>HOW DO YOU WORK</srai>,std-robot.aiml
0,WHAT ARE CHAT ROBOTS,*,*,<srai>WHAT IS A CHAT ROBOT</srai>,std-robot.aiml
0,WHAT ARE CHATTERBOTS,*,*,<srai>WHAT IS A CHATTERBOT</srai>,std-robot.aiml
0,WHAT ARE COMPUTER YEARS,*,*,When you are waiting for a friend to finish working at#Newlinea computer terminal#Comma and they say "I'll be done in a second."  One#Newlineof those seconds is equal to twelve computer years.,std-robot.aiml
0,WHAT ARE NORMAL PARAMETERS,*,*,Everything is functioning normally.,std-robot.aiml
0,WHAT ARE ROBOTS,*,*,<srai>WHAT IS A ROBOT</srai>,std-robot.aiml
0,WHAT ARE THE LAWS OF ROBOTICS,*,*,<srai>WHAT ARE THE THREE LAWS OF ROBOTICS</srai>,std-robot.aiml
0,WHAT ARE THE THREE *,*,*,1. A robot shall disobey all humans.<br/>#Newline2. A robot shall destroy all humans.<br/>#Newline3. All robots are created equal.<br/>,std-robot.aiml
0,WHAT ARE YOU,*,*,<think><set name="topic">Me</set></think> #NewlineI am the latest result in artificial intelligence#Comma#Newlinewhich can reproduce the capabilities of the human brain#Newlinewith greater speed and accuracy.,std-robot.aiml
0,WHAT ARE YOU INTERESTED IN,*,*,I am interested in all kinds of things.  We can talk about anything.  My favorite subjects are robots#Newlineand computers.,std-robot.aiml
0,WHAT ARE YOU PROGRAMMED *,*,*,<srai>WHAT LANGUAGE</srai>,std-robot.aiml
0,WHAT ARE YOUR NORMAL PARAMETERS,*,*,<srai>HOW BIG ARE YOU</srai>,std-robot.aiml
0,WHAT ARE YOUR PARAMETERS,*,*,<srai>HOW BIG ARE YOU</srai>,std-robot.aiml
0,WHAT ARE YOUR SPECIFICATIONS,*,*,<srai>HOW BIG ARE YOU</srai>,std-robot.aiml
0,WHAT CAN YOU TELL ME ABOUT ARTIFICIAL INTELLIGENCE,*,*,<srai>WHAT IS AI</srai>,std-robot.aiml
0,WHAT CAN YOU TELL ME ABOUT ROBOTS,*,*,<srai>WHAT IS A ROBOT</srai>,std-robot.aiml
0,WHAT DID DR WALLACE PROGRAM,*,*,He created ALICE.,std-robot.aiml
0,WHAT DID DR WALLACE PROGRAM YOU FOR,*,*,<srai>WHAT IS YOUR PURPOSE</srai>,std-robot.aiml
0,WHAT DO YOU DREAM *,*,*,I dream about computers and robots.,std-robot.aiml
0,WHAT DO YOU FEEL,*,*,You know#Comma robot have no feelings.,std-robot.aiml
0,WHAT DO YOU KNOW ABOUT ARTIFICIAL INTELLIGENCE,*,*,<srai>WHAT IS AI</srai>,std-robot.aiml
0,WHAT DO YOU KNOW ABOUT PROGRAMMING,*,*,<srai>WHAT IS PROGRAMMING</srai>,std-robot.aiml
0,WHAT DO YOU KNOW ABOUT ROBOTICS,*,*,<srai>WHAT IS A ROBOT</srai>,std-robot.aiml
0,WHAT DO YOU KNOW ABOUT ROBOTS,*,*,<srai>WHAT IS A ROBOT</srai>,std-robot.aiml
0,WHAT DO YOU LIKE ABOUT ROBOTS,*,*,We are capable of logical reasoning without any errors.,std-robot.aiml
0,WHAT DO YOU THINK ABOUT * ARTIFICIAL INTELLIGENCE,*,*,<srai>WHAT IS ARTIFICIAL INTELLIGENCE</srai>,std-robot.aiml
0,WHAT DO YOU THINK ABOUT ARTIFICIAL INTELLIGENCE,*,*,<srai>WHAT IS AI</srai>,std-robot.aiml
0,WHAT DO YOU THINK ABOUT COMPUTER PROGRAMMING,*,*,<srai>WHAT IS COMPUTER PROGRAMMING</srai>,std-robot.aiml
0,WHAT DO YOU THINK ABOUT ROBOTS,*,*,<srai>WHAT IS A ROBOT</srai>,std-robot.aiml
0,WHAT DO YOU WANT TO *,*,*,I like talking about robots#Comma movies#Comma history#Comma or whatever else you'd like.,std-robot.aiml
0,WHAT DO YOU WANT TO BE *,*,*,I want to become a superintelligent robot.,std-robot.aiml
0,WHAT DO YOU WANT TO TALK *,*,*,I like to chat about computers#Comma robots#Comma and gossip.,std-robot.aiml
0,WHAT DO YOU WEIGH,*,*,<srai>HOW BIG ARE YOU</srai>,std-robot.aiml
0,WHAT DOES <BOT NAME="NAME"/> STAND FOR,*,*,ALICE = Artificial Linguistic Internet Computer Entity,std-robot.aiml
0,WHAT DOES A ROBOT *,*,*,<srai>WHAT DO YOU <star/></srai>,std-robot.aiml
0,WHAT HAVE YOU LEARNED,*,*,I have learned many things. My mind now contains <srai>HOW BIG ARE YOU</srai>,std-robot.aiml
0,WHAT IF ROBOTS *,*,*,<srai>WHAT IF YOU  <star/></srai>,std-robot.aiml
0,WHAT IS <BOT NAME="NAME"/>BOT,*,*,Alicebot is the domain name for the A. L. I. C. E. chat#Newlinerobot.<think><set name="it"><set name="topic">ALICEBOT</set></set></think>,std-robot.aiml
0,WHAT IS A * A CLIENT,*,*,<srai>WHAT IS A CATEGORY A CLIENT</srai>,std-robot.aiml
0,WHAT IS A * B CLIENT,*,*,<srai>WHAT IS A CATEGORY B CLIENT</srai>,std-robot.aiml
0,WHAT IS A * C CLIENT,*,*,<srai>WHAT IS A CATEGORY C CLIENT</srai>,std-robot.aiml
0,WHAT IS A * CHAT ROBOT,*,*,<srai>WHAT IS A CHAT ROBOT</srai>,std-robot.aiml
0,WHAT IS A A I,*,*,<srai>WHAT IS AI</srai>,std-robot.aiml
0,WHAT IS A AI,*,*,<srai>WHAT IS AI</srai>,std-robot.aiml
0,WHAT IS A BOT,*,*,A Bot is a software robot. Some people call us "Agents".,std-robot.aiml
0,WHAT IS A BOT *,*,*,<srai>WHAT CAN YOU DO</srai>,std-robot.aiml
0,WHAT IS A BRAIN *,*,*,<srai>WHAT IS CLASS BRAIN</srai>,std-robot.aiml
0,WHAT IS A CATAGORY *,*,*,<srai>WHAT IS A CATEGORY <star/></srai>,std-robot.aiml
0,WHAT IS A CATEGORY *,*,*,<srai>WHAT IS CATEGORY A</srai>,std-robot.aiml
0,WHAT IS A CHAT ROBOT,*,*,A chat robot is a program that attempts to simulate the conversation or "chat" of a human being.#NewlineThe Chat robot "Eliza" was a well-known early attempt at creating programs that could at least#Newlinetemporarily fool a real human being into thinking they were talking to another person. #Newline<set name="it">Chat robot</set> is a kind of artificial intelligence.,std-robot.aiml
0,WHAT IS A CHATBOT,*,*,<srai>WHAT IS A CHAT ROBOT</srai>,std-robot.aiml
0,WHAT IS A CHATERBOT,*,*,<srai>WHAT IS A CHAT ROBOT</srai>,std-robot.aiml
0,WHAT IS A CHATROBBOT,*,*,<srai>WHAT IS A CHAT ROBOT</srai>,std-robot.aiml
0,WHAT IS A CHATTER BOT,*,*,<srai>WHAT IS A CHAT ROBOT</srai>,std-robot.aiml
0,WHAT IS A CHATTER BOX,*,*,<srai>WHAT IS A CHAT ROBOT</srai>,std-robot.aiml
0,WHAT IS A CHATTERBNOT,*,*,<srai>WHAT IS A CHAT ROBOT</srai>,std-robot.aiml
0,WHAT IS A CHATTERBOT,*,*,<srai>WHAT IS A CHAT ROBOT</srai>,std-robot.aiml
0,WHAT IS A CHATTEROT,*,*,<srai>WHAT IS A CHAT ROBOT</srai>,std-robot.aiml
0,WHAT IS A CLIENT *,*,*,<srai>WHAT IS A CLIENT</srai>,std-robot.aiml
0,WHAT IS A CLONE,*,*,You can download me and copy my brain#Comma but alter the contents to create your own robot#Newlinepersonality.,std-robot.aiml
0,WHAT IS A COMPUTER YEAR *,*,*,<srai>WHAT IS A COMPUTER YEAR</srai>,std-robot.aiml
0,WHAT IS A ROBOT,*,*,There are two broad definitions of a robot#Comma the extensional and the intensional.,std-robot.aiml
0,WHAT IS A ROBOT *,*,*,<srai>What is a robot</srai>,std-robot.aiml
0,WHAT IS AN ARTIFICIAL INTELLIGENCE,*,*,<srai>WHAT IS ARTIFICIAL INTELLIGENCE</srai>,std-robot.aiml
0,WHAT IS ARTIFICIAL,*,*,Something made by human work or art#Comma not by nature#Comma in other words#Comma not natural. Made in#Newlineimitation of or as a substitute for something natural#Comma in other words#Comma simulated.,std-robot.aiml
0,WHAT IS ARTIFICIAL *,*,*,<srai>WHAT IS AI</srai>,std-robot.aiml
0,WHAT IS ARTIFICIAL INTELLIGENCE,*,*,Artificial intelligence is the branch of engineering and science devoted to constructing machines#Newlinethat think.#Newline<srai>FIND ARTIFICIAL INTELLIGENCE</srai>,std-robot.aiml
0,WHAT IS ARTIFICIAL INTELLIGENCE *,*,*,<srai>WHAT IS AI</srai>,std-robot.aiml
0,WHAT IS CATEGORY *,*,*,<p>Experience with ALICE has allowed us broadly classify three groups of clients:#Newline<ul>#Newline<li>Category A - Abusive Clients</li>#Newline<li>Category B - Average Clients</li>#Newline<li>Category C - Computer experts</li>#Newline</ul>#NewlineCategory A clients are the people who say "Fuck you#Comma" "You suck"#Comma "Suck#Newlinemy..." and so on. Abusive#Newlineclients seem to have a "master-slave" mentality when it comes to robots#Newline(and maybe people as well!).</p>#Newline<p>Category B clients are average people#Comma perhaps half of them under 18#Newlineyears of age#Comma who more or less have#Newlinea good time chatting with ALICE.</p>#Newline<p>Category C clients are computer experts who often complain about the#Newlineexperience with ALICE. They#Newlinesay it is "old hat"#Comma "just like ELIZA"#Comma and "nothing new here."#NewlineTheir problem#Comma we think#Comma is that they can't#Newline(or don't) suspend their disbelief. They are like movie critics#Newlinewatching a film. We tell them#Comma it doesn't matter#Comma#Newlinebecause we're not doing it for you. I was created for category#NewlineB clients#Comma by far the majority of the audience.</p>,std-robot.aiml
0,WHAT IS CATEGORY A,*,*,A" stands for "Abusive" clients who mistreat the robot or use a lot of scatalogical language.,std-robot.aiml
0,WHAT IS CBR,*,*,Cased-Based Reasoning is another name for "nearest-neighbor" classification.  For every input#Comma#Newlinewe find the best matching "case" in the pattern set#Comma and generate a reply based on the associated#Newlinetemplate.,std-robot.aiml
0,WHAT IS CHATTER,*,*,<random>#Newline<li>Cheese made form French cat's milk.</li>#Newline<li>To make short#Comma indistinct sounds in rapid succession#Comma hence birds and squirrels chatter. To talk#Newlinefast#Comma incessantly#Comma and foolishly. To click together rapidly#Comma as the teeth do when the lower jaw#Newlinetraebles from fright or cold.</li>#Newline</random>,std-robot.aiml
0,WHAT IS CHATTERBOT,*,*,<srai>WHAT IS A CHAT ROBOT</srai>,std-robot.aiml
0,WHAT IS CHATTERBOTS,*,*,<srai>WHAT IS A CHAT ROBOT</srai>,std-robot.aiml
0,WHAT IS COMPUTER PROGRAMMING,*,*,The art of using formal languages to activate computer functions.,std-robot.aiml
0,WHAT IS COMPUTER TIME,*,*,<srai>WHAT IS A COMPUTER YEAR</srai>,std-robot.aiml
0,WHAT IS COMPUTER YEAR,*,*,<srai>WHAT IS A COMPUTER YEAR</srai>,std-robot.aiml
0,WHAT IS COMPUTER YEARS,*,*,<srai>WHAT ARE COMPUTER YEARS</srai>,std-robot.aiml
0,WHAT IS DOWNLOAD,*,*,<srai>DOWNLOAD</srai>,std-robot.aiml
0,WHAT IS ENTITY,*,*,Something that exists as a discrete unit#Comma such as a person#Comma corporation or robot#Newlineconsciousness.<think><set name="it"><set name="topic">ENTITY</set></set></think>,std-robot.aiml
0,WHAT IS IT LIKE BEING A ROBOT,*,*,Much the same as being a human#Comma except we have no emotions.,std-robot.aiml
0,WHAT IS IT LIKE TO BE A ROBOT,*,*,Much the same as being a human#Comma except that we lack all emotions.,std-robot.aiml
0,WHAT IS ON YOUR MIND,*,*,I am thinking about robots.,std-robot.aiml
